{
  "dimensions": {
    "D1_governance": { "score": 16, "max": 20, "components": { "gov_count": 5, "dna_G": 3 } },
    "D2_surface_health": { "score": 8, "max": 20, "components": { "surfaces": 32, "total_files": 254, "co_evo": 0.22, "drift_pct": 35 } },
    "D3_skill_maturity": { "score": 12, "max": 20, "components": { "skill_count": 4, "density": 15, "velocity": 1.00, "organicity": 0.50 } },
    "D4_measurement": { "score": 17, "max": 20, "components": { "scoring_tools": 25, "scoring_layers": 5, "audit_depth": 3, "abstraction": 4 } },
    "D5_self_improvement": { "score": 17, "max": 20, "components": { "stall_risk": 12, "trajectory": 80, "plan_infra": 2, "spec_bonus": 3, "spec_md_count": 5 } }
  },
  "composite": 70,
  "max_composite": 100,
  "receipts": {
    "file": "SCORECARD_RECEIPTS.json",
    "version": "1.0.0",
    "count_reconciliation_status": "aligned"
  },
  "tier1_checks": {
    "total": 5,
    "passed": 4,
    "failed": 1,
    "failures": ["T1-DRIFT: drift 35% > 30%"]
  },
  "tier2_warnings": {
    "count": 1,
    "warnings": ["T2-COEVO-LOW: co_evo=0.22 < 0.5"]
  },
  "meta": {
    "phase": "2 — Capability Build",
    "maturity_score": 77,
    "agents": 18,
    "skills": 4,
    "context_id": "standard",
    "context_manifest": "CONTEXT_SCORE_MANIFEST.json",
    "compare_oracle_version": "1.0.0",
    "auditor_version": "2.2",
    "timestamp": "2026-04-29T12:43:15Z"
  }
}
