{
  "composite": 60,
  "dimensions": {
    "D1_governance": {
      "components": {
        "dna_G": 3,
        "gov_count": 5
      },
      "max": 20,
      "score": 16
    },
    "D2_surface_health": {
      "components": {
        "co_evo": 0.22,
        "drift_pct": 84,
        "surfaces": 32,
        "total_files": 306
      },
      "max": 20,
      "score": 8
    },
    "D3_skill_maturity": {
      "components": {
        "density": 13,
        "organicity": 0.5,
        "skill_count": 4,
        "velocity": 0.0
      },
      "max": 20,
      "score": 7
    },
    "D4_measurement": {
      "components": {
        "abstraction": 4,
        "audit_depth": 3,
        "scoring_layers": 5,
        "scoring_tools": 35
      },
      "max": 20,
      "score": 17
    },
    "D5_self_improvement": {
      "components": {
        "plan_infra": 2,
        "spec_bonus": 3,
        "spec_md_count": 13,
        "stall_risk": 17,
        "trajectory": 10
      },
      "max": 20,
      "score": 12
    }
  },
  "max_composite": 100,
  "meta": {
    "agents": 18,
    "auditor_version": "2.2",
    "compare_oracle_version": "1.0.0",
    "context_id": "standard",
    "context_manifest": "CONTEXT_SCORE_MANIFEST.json",
    "maturity_score": 77,
    "phase": "2 \u2014 Capability Build",
    "skills": 4,
    "timestamp": "2026-05-22T23:42:55Z",
    "audit_status": "completed",
    "artifact_status": "completed",
    "missing_required_artifacts": []
  },
  "receipts": {
    "count_reconciliation_status": "aligned",
    "dual_inventory": {
      "file": "SCORECARD_RECEIPTS.json",
      "full_facts_auditor_pruned_total_files": null,
      "full_facts_denominator_mode": "not_measured",
      "full_facts_inventory_status": "available",
      "full_facts_minimum_complete_cap": null,
      "full_facts_recommended_rerun_cap": null,
      "full_facts_scan_coverage_ratio": null,
      "full_facts_scan_limit": 1000,
      "full_facts_scan_limit_guidance_status": "not_needed",
      "full_facts_scan_limit_reached": false,
      "full_facts_total_files_scanned": 306,
      "full_facts_trusted_local_override": null,
      "git_tracked_file_count": null,
      "non_authorization": true,
      "primary_surface_count": 87,
      "primary_surface_inventory_status": "available",
      "version": "1.0.0"
    },
    "file": "SCORECARD_RECEIPTS.json",
    "version": "1.0.0"
  },
  "tier1_checks": {
    "failed": 1,
    "failures": [
      "T1-DRIFT: drift 84% > 30%"
    ],
    "passed": 4,
    "total": 5
  },
  "tier2_warnings": {
    "count": 1,
    "warnings": [
      "T2-COEVO-LOW: co_evo=0.22 < 0.5"
    ]
  }
}
