{
  "dimensions": {
    "D1_governance": { "score": 12, "max": 20, "components": { "gov_count": 4, "dna_G": 2 } },
    "D2_surface_health": { "score": 8, "max": 20, "components": { "surfaces": 30, "total_files": 77, "co_evo": 0.11, "drift_pct": 34 } },
    "D3_skill_maturity": { "score": 13, "max": 20, "components": { "skill_count": 2, "density": 23, "velocity": 1.00, "organicity": 0.50 } },
    "D4_measurement": { "score": 14, "max": 20, "components": { "scoring_tools": 9, "scoring_layers": 4, "audit_depth": 3, "abstraction": 4 } },
    "D5_self_improvement": { "score": 15, "max": 20, "components": { "stall_risk": 12, "trajectory": 80, "plan_infra": 2 } }
  },
  "composite": 62,
  "max_composite": 100,
  "tier1_checks": {
    "total": 5,
    "passed": 4,
    "failed": 1,
    "failures": ["T1-DRIFT: drift 34% > 30%"]
  },
  "tier2_warnings": {
    "count": 2,
    "warnings": ["T2-COEVO-LOW: co_evo=0.11 < 0.5","T2-NO-CRITIC: no adversarial critic detected (L29)"]
  },
  "meta": {
    "phase": "2 — Capability Build",
    "maturity_score": 69,
    "agents": 18,
    "skills": 2,
    "auditor_version": "2.2",
    "timestamp": "2026-02-24T02:47:19Z"
  }
}
